{
  "enabled_connectors": ["msgraph"],
  "connector_scopes": {
    "msgraph": [
      "https://graph.microsoft.com/Application.Read.All",
      "https://graph.microsoft.com/Directory.Read.All",
      "https://graph.microsoft.com/Policy.Read.All",
      "https://graph.microsoft.com/Reports.Read.All",
      "https://graph.microsoft.com/User.Read.All",
      "https://graph.microsoft.com/AuditLog.Read.All"
    ]
  },
  "allowed_collections": ["assessment-scan"],
  "allowed_resources": {
    "msgraph": [
      "applications",
      "servicePrincipals",
      "users",
      "directoryRoles",
      "identity/conditionalAccessPolicies",
      "reports/authenticationMethods/userRegistrationDetails",
      "subscribedSkus",
      "auditLogs/signIns"
    ]
  },
  "retention": {"days": 90},
  "redaction_mode": "strict",
  "rate_limits": {
    "tenant_dispatch_per_minute": 10,
    "connector_dispatch_per_minute": 5,
    "failure_cooldown_threshold": 3,
    "failure_cooldown_seconds": 300
  }
}
